Unnamed: 0,text,label
2227,"The fossil has most of the face and mandible with teeth and , uniquely , a natural endocast of the braincase .",1
563,The atmosphere is modeled as a fluid .,1
1388,Matches may also be played on Tuesdays or Wednesdays instead of the regular Thursdays due to scheduling conflicts .,0
1247,In the United States most employment in the field requires either a masters degree in statistics or a related field or a PhD .,0
1581,Typically the inner container is immersed about halfway into the working fluid .,0
106,The group became alarmed when they heard her scream .,0
2388,In 2012 Nanninga went into a coma and only regained conscience five months later .,1
1348,The first edition covered 45 objects numbered M1 to M45 .,0
1047,"The channel broadcasts live from 5 am to midnight , with a newscast updated every 15 minutes in format .",0
519,"People associate certain colors with certain flavors , and the color of food can influence the perceived flavor in anything from candy to wine .",1
2480,"The trematodes or flukes are estimated to include 18,000 to 24,000 species",1
2423,Histones undergo changes which alter their interaction with DNA and nuclear proteins .,1
2033,Black powder rocket propellant is a lot like old fashioned gunpowder .,1
2794,The band - gap energy of semiconductors tends to decrease with increasing temperature .,1
662,"In 1892 he went to Paris , where he taught singing , and he coached many American and French artists for the operatic stage .",0
1001,From 1975 a phenomenon is growing .,0
953,"Common-use terminal designs means airlines share check - in counters , gates and IT systems .",0
1990,The state and union territory capitals are sorted according to no legislative and judicial capitals .,1
1962,Plants and animals living in the desert need special adaptations to survive in the harsh environment .,1
794,All organisms studied contain many RNases of many different sorts .,1
355,Lisa only works certain shifts in the evening because she is extremely busy during the day .,0
155,Liam stayed around while Jess worked on her art assignment .,0
77,Young children are very fond of coloring pictures with crayons in coloring books .,0
1103,By the end of the year French armies had won victories on all fronts .,0
2661,These sometimes immense gatherings fuel the ocean food web .,1
372,Beans are very healthy and nutritious .,0
547,Swine influenza virus is common throughout pig populations worldwide .,1
699,"There is a huge statue erected in honor of all the Netherlands sea-rescuers , opened in 1935 and is sometimes mistakenly assumed to honor Dorus .",1
2660,"In some non-mammal species , including fish and birds , the tectum is one of the largest components of the brain .",1
2455,The two quantifiers most widely used are the universal quantifier and the existence quantifier .,1
471,"In straight pool , the person shooting may attempt to pocket any ball on the table .",0
2373,"Over 120 species of cuttlefish are currently recognized , grouped into six families .",1
1067,"For transportation to centers , some shelters offer free transportation .",0
2510,"New species have been created by domesticated animal husbandry , but the initial dates and methods are not clear .",1
1499,Two ballets caused great excitement in Paris in the 1830s .,0
1316,"Construction of the temple complex started in approximately 1264 BC and lasted for about 20 years , until 1244 BC .",0
262,Saturn is a ringed planet .,1
2265,"A satellite terminal is a building detached from other airport buildings , so that aircraft can park around its entire circumference .",1
1274,"During December to March , the lake turns to a vibrant cobalt blue color .",0
1491,"By the 1990s , the Federal government had changed its mind on wolves .",0
2607,Natural selection has driven the origination and diversification of the toxins to counter the defenses of their prey .,1
531,Geography as a discipline can be split broadly into two main subsidiary fields : human geography and physical geography .,1
1383,"Each round uses 6 16 - bit sub-keys , while the half- round uses 4 , a total of 52 for 8.5 rounds .",0
1426,"Draft order in the Entry Draft is determined by a combination of lottery , regular season standing , and playoff results .",0
783,Creos is working towards the national electric vehicle objective that consists of installing 800 public charging stations for electric cars and hybrid plug- in cars across the country by 2020 .,1
757,Pavement lights and related products were historically marketed as a way of saving on artificial lighting costs and making space more usable and pleasant .,1
2431,"Over the next few days , a psychological war takes place .",1
1114,The school is known for having a large number of white students compared with the national average .,0
970,"Many right -wing politicians supported the proposal , meaning it would reduce unreported employment .",0
509,"Shores are influenced by the topography of the surrounding landscape , as well as by water induced erosion , such as waves .",1
1794,The city is a major trading and farming center in this area .,0
611,A merger was proposed already in 1964 but did n't become reality until a meeting on 6 December 1992 .,0
689,"The pelican eel 's most notable feature is its large mouth , which is much larger than its body .",0
2638,"Although its surface circulation had dissipated , its upper circulation remained unbroken and created a burst of rainfall early on August 20 .",1
1440,The second season introduced a new format that includes new signs and more original music .,0
2320,"Immediately after their senate confirmation , the emperors went to the camp of the praetorian guard .",1
1326,A tropical wave moved off the coast of Africa on August 9 .,0
2773,"Dormice are small rodents , with body lengths between 6 and , and weights between 15 and .",1
2689,"In rocks of the Mesozoic era , gastropods are slightly more common as fossils ; their shells are often well preserved .",1
97,American politics has n't changed --- unless it has gotten worse .,0
326,There is an urgent need for more doctors who are willing to volunteer in Africa .,0
477,The most common chicken and waffle pairing comes from the American soul food tradition and uses fried chicken .,0
828,A useful way to work around these gaps in knowledge is to find links to other known events .,0
1165,The pitching distance can range between 35 and 43 feet .,0
640,"All formulas in this article are correct in SI units , but in other unit systems , the formulas may need to be changed .",0
837,"Despite the key rarely being used in orchestral music other than to modulate , it is not entirely uncommon in keyboard music .",0
2279,"At the 2001 Census , the population of the civil parish was 20,309 , remaining similar at the 2011 Census .",1
383,Her favorite bracelet suddenly disappeared .,0
2086,Canada provided a thermal plasma analyzer .,1
2468,There are a variety of symptoms that have may cause sensory overload .,1
2555,"As surveying is related to mathematics , he later studied the geometrical importance of complex numbers .",1
2077,The physics engine is responsible for emulating the laws of physics realistically within the application .,1
2797,The amethyst woodstar 's natural habitats are subtropical or tropical moist lowland forest and subtropical or tropical moist montane forest .,1
2069,The damper consists of an inner hub attached to the end of the crankshaft .,1
715,The guaracha is a genre of rapid tempo and with lyrics .,1
1068,"Usually , sex is determined by an organism 's genes .",0
150,The little girl placed the doll carefully on her bed and kissed its cheek as gently as if it were a real boy .,0
931,This gives the number 's distance from zero on the real number line .,0
2157,Traditional gene names and abbreviations are often not specific for a single gene .,1
1609,The following is a partial list of songs featured in the film along with the artist that popularized them .,0
797,At straight rail 's inception there was no restriction on the manner of scoring .,1
2650,The proliferation of this weapon is shown by more than just numbers .,1
1740,Small handmade balls contain a lead pellet wrapped in rubber and wool with a leather cover .,0
881,A dry-cleaning machine is similar to a combination of a domestic washing machine and clothes dryer .,0
829,"Pinnipeds spend many months at a time at sea , so they must sleep in the water .",0
2147,His role is ceremonial as in many parliamentary democracies .,1
454,A total of thirteen people have served as Prime Minister of Upper Volta / Burkina Faso .,0
1805,"Between the years of 1991 and 1994 , several accidental and unrelated employee deaths occurred .",0
677,"During the late twentieth century , more and more mosques have been used for political purposes .",0
81,I know what I 'm doing is worthwhile when I see my students successful and happy with their lives .,0
2019,"An artist who operates a printing press to execute their own works of printing press such as , hand in limited runs .",1
1565,The first huts and shelters were constructed by hand or with simple tools .,0
2645,The signs and symptoms of African trypanosomiasis happen in two stages .,1
2622,"He discovered some comets , including periodic comet 22P / Kopff and the non-periodic C / 1906 E1 .",1
1889,"The novel tells about ideal civilization of powerful mages which have invited paranormal skills like telepathy , levitation and mediumism .",1
695,"In the very early versions of quicksort , the leftmost element of the partition would often be chosen as the pivot element .",1
1205,"The game ends when a player plays every tile in his or her rack , and there are no remaining tiles to draw .",0
2140,Scientists keep doing research on ways to prevent and treat dengue .,1
1506,An average adult American alligator weighs 360 kg and is 4.0 m long .,0
260,It 's nice to see more interracial couples who are accepting of our differences .,1
1179,"The airport still has an important role in emergency services operation , civil operation , and flight training .",0
254,He forgot to walk the dog last night so now there is a big mess to clean .,0
1583,The university has its own campus with a total area of 35 000 m2 .,0
1645,Many course themes are repeated throughout the series .,0
546,"Despite this increase in popularity , there are people who criticize the use of this dialect .",1
2575,"In the past , chikungunya existed mostly in developing countries .",1
478,The top of a pass is often the only flat ground in the area so it is often a good site for buildings .,0
1412,Weight training is a safe form of exercise when the movements are controlled and carefully defined .,0
2298,Groups of galaxies are the smallest aggregates of galaxies .,1
1828,"On 29 August 2016 , he was reported to be in intensive care after suffering a stroke .",0
278,"Although you 've no doubt seen this kind of crime before , it is nevertheless shocking to see the violence .",0
1557,Airolo is also home to a small ski-resort with 30 km of prepared slopes .,0
2620,Some skyscrapers feature rooftop heliports or helistops to serve the transport needs of executives or clients .,1
2667,The animal was robust with powerfully built jaws and very strong forelimbs .,1
1476,The basic economical activity of this department is cattle raising .,0
702,"In May 1863 , the inspector-general had directed the police to act on their own initiative .",1
2490,"As artillery developed technically , almost all guns of any size could be moved at some speed .",1
1030,The museum also displays copies of the Erfurt Hebrew Manuscripts .,0
2402,"The Canons are not supposed to be an absolute explanation of the Reformed doctrine , but only explain the five points of doctrine that were being argued over .",1
2751,"Concerts involving a greater number of artists , especially those that last for multiple days , are known as festivals .",1
2692,"For the individual , information security has a significant effect on privacy , which is viewed very differently in various cultures .",1
493,His early work was on the conductivity of electrolytes .,1
655,"At present , the school has already 40 sets of computers and other facilities needed by the growing population .",0
486,"Deep frying produces large amounts of waste oil , which must be disposed of properly .",0
2351,The long-tailed sylph is similar in appearance but does not overlap in range .,1
2635,"Various political ideologies , such as Christian democracy , can be classified as centrist .",1
1002,Emergencies often require delivery of different versions of the same communication at the same time .,0
384,"When the alarm sounded , all the doors were locked and we were asked to remain in one room .",0
1094,Demarest traveled around on foot to learn more about the Earth 's structure .,0
2381,Another risk is that most BASE jumping venues have very small areas in which to land .,1
2618,"Typically , battle royale contestants are only given one life to play ; any players who die are not allowed to respawn .",1
315,"Take it from me , you are much better off thinking about all the things in life you are grateful for than complaining about things that upset you .",0
1899,"Until 1964 , state senators were generally elected from districts that were not necessarily equal in population .",1
545,The autism rights movement is sometimes controversial .,1
2166,"In 1971 , she suffered a miscarriage in the eighth month of pregnancy and survived clinical death .",1
2249,"Chicken or veal parmigiana has become very popular in Australia as a pub dish , often served with chips and salad .",1
1123,"He died in London on 5 December 2013 , aged 75 , from undisclosed causes .",0
54,She must come from a very different cultural background from ours .,0
2268,The cheap and simple water aspirator is the most common type of aspirator .,1
1876,Most of the city 's 19th century houses were built of limestone mined nearby .,0
1516,"On 6 and 7 September 2013 , double international games between Sweden and Finland were played inside .",0
319,He carefully moved across the crowded room .,0
2236,Farmer was diagnosed with esophageal cancer in the spring of 1970 .,1
2175,The diagram illustrates the encryption process .,1
489,"Captive breeding is difficult , partly because of the relatively infrequent breeding cycle .",1
1890,Moose are mostly diurnal .,1
822,The two common forms of playing golf are match play and stroke play .,0
674,"The silver birch is a medium-sized tree , which has triangle - shaped leaves .",0
2375,Copper is the electrical conductor in many categories of electrical wiring .,1
832,The first European to come to the region may have been the Spaniard Alonso de Ojeda in 1499 .,0
1829,"The current trophy is made from silver and gilt , and features a golden globe held up by three silver columns .",0
2672,These birds feed on nectar from flowers using a long tongue .,1
1989,"In computational linguistics , a stem is the part of the word that never changes even when different forms of the word are used .",1
1279,Air cooling is making the temperature of an object lower using air .,0
2766,"The rabi crops are sown around mid-November , after the monsoon rains are over , and harvesting begins in April / May .",1
2323,"Pots , traditionally made of terracotta but now more commonly plastic , and window boxes have been the most commonly seen .",1
1122,"started as a political youth organization in 2000 and became a political party in January 2006 , running in the 2006 elections .",0
790,"Military decorations , service awards , and medals are often mistakenly confused with one another .",1
2647,Feature movies usually have insurance when principal photography starts .,1
2512,The tombstones use to have some inscriptions .,1
867,"There are a lot of operating systems , which are based on FreeBSD .",0
1834,The strong taste that people associate with anchovies is due to the curing process .,0
1719,Japan was the first country to build railway lines for high speed travel .,0
2048,As Coordinating Minister of Strategic Sectors he was responsible for the building of several hydroelectric power plants the he had to borrowed money from Chinese banks to build .,1
1057,"While production on the show wrapped in February 2001 , new episodes were shown until March 2004 .",0
2713,Death masks were increasingly used by scientists from the late 18th century onwards to record variations in human physiognomy .,1
291,By telling jokes in class Professor Allen kept his students alert and amused .,0
2539,"If the electron absorbs a quantity of energy less than the binding energy , it will be transferred to an excited state .",1
680,"To the band 's surprise , the song became a hit at prom dances .",0
2080,"Type I collagen is present in many forms of connective tissue , and makes up about 25 % of the total protein content of the mammalian body .",1
759,"Boomerang coasters have occasionally stalled , often in the Cobra Roll element .",1
2289,"The trustee is given legal title to the trust property , but has an obligation to act for the good of the beneficiaries .",1
1771,Points and goals will carry over in full from regular season .,0
1173,"In the 1990s , major card issuers in the US raised the cash- back percentage up to 5 % .",0
779,The oldest khachkars in the cemetery go back to the late 10th century .,1
2210,"In the 1890s , a variant known as bridge whist became popular .",1
1007,It is important to keep children with croup as calm as possible .,0
2245,"In 1979 , funding was received to preserve the site as a tourist destination , due to its historical significance .",1
769,The vibrant colors of the coat of arms are to point to a bright future for the islands .,1
2159,The assessment of job satisfaction through employee anonymous surveys became commonplace in the 1930s .,1
2639,"At the other end of the spectrum , the 15 percent of people in the developed countries have 80 percent of global income .",1
385,The car doors were locked and the alarm was on .,0
1864,"Basketball is today played by more than 300 million people worldwide , making it one of the most popular team sports .",0
2676,A claw is made of hard protein called keratin .,1
1105,"Its economy consists mainly of mining , agriculture and fishing .",0
101,I 'd like to take a trip somewhere to see new places and meet new people .,0
972,"This spider is yellowish - brown with many dark spots on the rear half , in no order .",0
2521,Researchers have also found illusory superiority in relationship satisfaction .,1
2073,"The tree forms a thick , rugged bark containing high levels of suberin .",1
1363,"The commune has an area of 1466.7 sqkm and the city proper , 16.16 sqkm .",0
5,The assignment is impossible to finish because it 's so time - consuming .,0
2419,"Team variations of battle royals consist of designated tag teams of wrestlers , usually two to a team .",1
2752,"Because of their size range , it is probable that different species hunted in different ways and allowed them to fill many different predatory niches .",1
1216,"As of 2010 , the municipality had a total population of 8,343 , up from 7,172 as of 2005 .",0
2425,Most dolmen constructions were built using stone slabs of big dimensions .,1
225,I got my cat a collar with bells .,0
705,Frontal bossing is when the forehead becomes bigger than normal which may also make the brow ridge stick out more .,1
1646,"The main criticisms were of the two -player mode , a first for the series .",0
2257,Carreras has received many awards both because of his musical and humanitarian work .,1
1106,"Main industries in the province are mining , agriculture and fishing .",0
2822,French is the only official language in France as a whole and in these municipalities .,1
1332,The shopping mall is located on both the northern and the southern side of the E4 motorway and is connected with a covered bridge spanning across the motorway .,0
1147,Solar cells produce direct current electricity from sunlight which can be used to power equipment or to recharge a battery .,0
1187,"At the level of the operating system , SATA and PATA devices can be made to look the same .",0
819,The above arguments hold in any ring .,0
2528,"An epigenetic contribution to heterosis has been established in plants , and it has also been reported in animals .",1
1763,"On each usual episode , a celebrity guest came on the show with a secret .",0
2167,She suffered a miscarriage and survived clinical death .,1
2448,Producing an image from a diffraction pattern requires sophisticated mathematics .,1
2266,TUTTs sometimes bring a large amount of vertical wind shear over tropical disturbances and cyclones so TUTTs can reduce cyclone development .,1
456,Final development of the M1918A2 was authorized on 30 June 1938 .,0
2433,Roads entering the City are narrowed and have small chicanes to force drivers to slow down and be recorded by CCTV cameras .,1
459,There are many causes of kidney disease .,0
2138,"There are not as many symphonies in A major as in D major or G major , but more than other sharp keys .",1
1273,"In more recent years , many projects have attempted to bridge the gap in our knowledge caused by the Zone of Avoidance .",0
392,This is a medical alert bracelet .,0
1542,Points were awarded to the top 10 classified finishers .,0
2551,An addition reaction is the reverse of an elimination reaction .,1
2716,The procedures of the Diet of Japan have moved away from the British parliamentary model .,1
1658,"Today , it is the largest public research university in Bangladesh , with a student body of 33,000 and a faculty of 1,800 .",0
1875,Research usually involves a mixture of field and laboratory studies .,0
1653,The following shows several D capabilities and D design trade- offs in a very short program .,0
79,"We will meet better , more intelligent people than the ones back in high school .",0
2390,About 10 % of all sedimentary rocks are limestones .,1
708,"There are 242 tokens on the disc , comprising 45 distinct signs .",1
301,I am disappointed by what I find in my refrigerator .,0
2012,"About 400 hotels and restaurants were ordered to close for violating local environmental laws , while 3 casinos have been permanently shut down .",1
1748,At 10.00 am there was a large crowd of people watching the action .,0
2461,"Each course of the university has its own recruitment process , most of the time by a competitive examination .",1
2347,"With global travel becoming widespread at that time , cookies made a natural travel companion , a modernized equivalent of the travel cakes used throughout history .",1
2274,"The seeds are extremely small and very numerous , in some species over a million per capsule .",1
373,We qualified for the bridge tournament .,0
2774,Most of the coins of later series have specific commemorative topics and are usually made of precious metal .,1
2036,"IM allows effective and efficient communication , allowing immediate receipt of acknowledgment or reply .",1
722,"Most myosin molecules are composed of a head , neck , and tail domain .",1
31,"See a doctor , or the infection may get worse .",0
525,The Tentative List consists of sites which have been nominated .,1
2007,"The electrolysis of water breaks water into hydrogen and oxygen , using electricity .",1
1148,The relief decoration was removed in 1945 .,0
944,The following players have also been called up to the England squad within the last 12 months .,0
1060,"During the war , the town was completely destroyed .",0
2204,In one form or another slavery has been practiced since the earliest civilizations .,1
401,Sometimes I wish I had the power to go back in time and change some of the decisions I made .,0
2674,"The provinces are grouped into seventeen regions based on geographical , cultural , and ethnological characteristics .",1
2123,The victorious rebels formed a government that abolished the military .,1
304,Some teachers with large classes never get to know their students .,0
1972,"During the third hour after the shooting , an autopsy was performed due to overwhelming media interest .",1
1226,The fourth generation iPad shipped with iOS 6.1 .,0
2475,Alternation of generations between a multicellular diploid and a multicellular haploid generation does not exist in animals .,1
2630,Camel case is used in some wiki markup languages for terms that should be automatically linked to other wiki pages .,1
901,This work supported the big-bang theory of the universe beginning .,0
2144,All 16 - bit programs run by default in a single virtual DOS machine with shared memory space .,1
1170,Construction on a new bridge began in 1987 and opened to traffic in 1992 .,0
1591,"As of , there are four living former second ladies , as identified below .",0
151,"Before John 's allergic reaction gets worse , I think we should take him to a clinic so they can provide him with exactly what he needs .",0
1954,"Livestock activities are also economically relevant , with pigs and cattle being the most important .",1
2163,"Metals typically are strong , dense , and good conductors of both electricity and heat .",1
1696,Bear is often classified as a hard science fiction author due to the level of scientific detail in his work .,0
1478,There are many forms of liver disease .,0
2563,This is thought to be one of the most important battles for the control of the Indian subcontinent by the colonial powers .,1
524,"In the interwar years urban London further expanded , with the expansion of public transport , and the setting up of new industries outside inner London .",1
1507,A recording medium is a physical material that holds data expressed in any of the existing recording formats .,0
1584,"In 1882 , the government decided to build a new central passenger station to replace the existing ad-hoc station buildings .",0
2756,A similar calendar found nearby at Villards d'Heria is only preserved in eight small fragments .,1
1847,"In 2005 , the municipality had a total population of 70,160 .",0
