Unnamed: 0,text,label
183,"Before flying off to America , Ally gave each of her siblings a big hug and a present .",0
2047,Most Irish immigrants to the United States during this period favored large cities because they could create their own communities for support and protection in a new environment .,1
808,"Great part of his career , he had to deal with defending worshipping god in an environment of the anti-religious doctrine of communism .",1
2666,"Despite these protests , the film was critically acclaimed , with praise directed towards its dialogues and the actors ' performances in particular .",1
1859,After his football career he became a successful international referee .,0
2133,It is a fallacy because the moral character or actions of the opponent are generally irrelevant to the logic of the argument .,1
879,"As of 2005 , the municipality had a total population of 2,647 .",0
504,"In drinking water , the higher the turbidity level , the higher the risk that people may develop diseases .",1
851,"There are however many variations , and many surprising aspects .",0
12,William finds literature fascinating .,0
1900,"In international law , contraband means goods sent to territories under the control of the enemy that can be used in armed conflict .",1
1920,The high amount of oxygen gas on Earth is because of the oxygen cycle .,1
810,"The barn owls ' main characteristic is the heart- shaped facial disc , formed by stiff feathers which serve to amplify and locate the source of sounds when hunting .",1
2740,"Morenz died from complications of a broken leg , an injury he suffered in a game .",1
1785,The sketches themselves were the first ever done in oils directly from the subject in the open air .,0
1535,European colonies began with the Spanish settlement of Santa Catarina island in 1542 .,0
1533,"A three - hour special marking the end of the show aired on November 16 , 2008 .",0
1937,Epidemiology is the study of the factors that cause or encourage diseases .,1
414,Some airports in Japan do not fall under the scope of the Japanese airport statutes .,0
1674,"Numbers one to six on the list are events which are of huge importance , but about which we know relatively little .",0
801,The amount of propellant can be measured either in units of mass or weight .,1
1164,The relative minor is F minor .,0
663,The first child born from egg donation was in 1983 in Australia .,0
292,Few people succeed in starting their own business and profiting greatly from it .,0
952,Historically there have also been negative consequences .,0
1946,Access to this area was also incorporated into the neighboring East Stand on several levels ; the spectator capacity of the structure is 202 .,1
1613,Note that the description of a device as either input or output depends on how it is viewed .,0
798,The frequency chosen for measuring candelas is in the visible spectrum near green .,1
2603,"Superscalar CPU design emphasizes improving the instruction dispatcher accuracy , and allowing it to keep the multiple execution units in use at all times .",1
2731,Balls of solid glass occasionally were used in a method thought to prevent lightning strikes to ships .,1
1869,Due process developed from clause 39 of the Magna Carta in England .,0
391,Many kinds of fruit have tough skin on the outside that people throw away .,0
1125,The film won two wac awards of its eight nominations .,0
111,He always gets very red when he is embarrassed .,0
2128,The cells of the epidermis can vary in the way they are made and how they work .,1
2361,"Of knightly extraction , has proofs of its nobility going back as far as 1265 .",1
1867,The network focuses on supporting peer-directed and open-source projects .,0
290,She told what I saw as a convincing story of her experiences .,0
1195,The project will also include 420 to 470 units of housing .,0
1385,The purpose of classification is to protect information .,0
1267,Reviewers criticized the film 's advertisement campaign .,0
625,Sake Dean Mahomed also developed a fashionable massage .,0
1648,"Scotland is the joint oldest national football team in the world , alongside England , whom they played in the world 's first international football match in 1872 .",0
1991,The practice is generally considered safe sex as long as the hands are protected with a latex gloves .,1
874,There are two versions of the anthem : a long and a short one .,0
2611,Spontaneous abortion occurs in various animals .,1
2570,Another problem for many small businesses is the capacity of much larger businesses to influence or sometimes determine their chances for success .,1
1223,"The species in this family vary in size , from 1.5 cm to 12 cm .",0
234,Dad never gives us permission to go to rock concerts .,0
887,Most click beetles are under 2 centimeters long and dull in color .,0
1606,"By the 1960s , the need for a new international terminal had become apparent , and work commenced in late 1966 .",0
398,Let 's create a world where education for all is valued .,0
652,"Agent 47 's appearance consisted of a pure black suit , black leather gloves , a white dress shirt and a red tie .",0
421,"Developed countries have , which means that the service sector becomes more important , and the is less important .",0
1293,"There should be multiple means of delivering emergency information so that if one fails , others may get through .",0
535,"Avant - garde represents a going against what is accepted as the norm , especially in culture .",1
30,Have you heard about the South African apartheid ?,0
799,Derwentwater is very scenic .,1
1910,Ortac is noted for its large gannet colony .,1
2450,"While the hypothesis was readily accepted by many in the environmentalist community , it has not been widely accepted within the scientific community as a whole .",1
1685,"Usually , such drives will be stamped with a company 's logo , as a form of advertising .",0
1886,"Politicians are known for their rhetoric , as in speeches or campaign advertisements .",1
71,The meeting was called to discuss why campus crimes have risen .,0
116,"Martin Luther King , Jr was an honorable man whose beliefs inspired millions of people and whose death was a tragedy that sparked rioting .",1
716,"Whether counsel is retained or appointed , the defendant has a right to counsel without a conflict of interest .",1
785,Many of the recurring characters of the series have received traits based on the respective element .,1
1904,"It has also been used to make lightweight blocks for building , and as a powdered ingredient in polishing .",1
449,Unemployment among a large portion of the population is part of the reason for crime .,0
433,"The 20th century , however , brought the need for a more precise definition .",0
109,"I liked what Obama said about how we need to take care of the young , old and sick in our society .",0
2715,"In the United States , teasel is an invasive species .",1
2806,In the center of a village the ground begins to open up and a strange green light emanates from within .,1
2064,"The concept , idea or philosophy of property underlies all property law .",1
1568,The traditional food is famous for many vegetables and greens used seasonally in the dishes .,0
2456,Bangladesh is used to move narcotics made in neighboring countries .,1
80,Timid people are often afraid of others .,0
465,The band initially planned to record their debut album in the space of two weeks .,0
2637,Engineers in the nineteenth century understood that a bridge that was continuous across multiple supports would distribute the loads among them .,1
2559,It is held in many mental health circles that masturbation can relieve depression and lead to a higher sense of self-esteem .,1
1449,The first two were rarely used except by clipper ships in light winds and were usually set flying .,0
1233,"Individual animals regularly clean themselves and put their fur , feathers or other skin coverings in good order .",0
1304,"The oldest anchors were just rocks , and many rock anchors have been found from a long time ago .",0
1411,On envelopes and postcards there are often four square boxes printed in orange ink at the bottom right for the postcode numbers .,0
736,"In the center is a machete and hoe , representing the revolution through which the nation gained independence and the importance of agricultural workers .",1
2772,"Some of the Mortier de 12 pouces were used for coastal defense , in which case they were fixed on solid metal platforms .",1
1078,"Although concentrated in London , the outbreak affected other areas of the country as well .",0
604,"To improve mechanized sorting , each address now has a sorting number which is printed on the letter as an orange colored barcode .",1
659,"Now known simply as Opera , the browser has become very popular despite the competition .",0
986,"In fast food chains , ketchup is often put in small packets that hold ketchup inside .",0
1943,"Starting from an appropriate initial value determined by the injection energy , the field strength of the dipole magnets is then increased .",1
1310,"The blast killed at least 91 people and injured 1,400 others .",0
1881,Alligators are generally timid towards humans and tend to walk or swim away if one approaches .,1
1590,"The median income for a household in the city was $ 28,542 , and the median income for a family was $ 27,500 .",0
125,"None of the food was vegan , and therefore did n't meet my dietary needs .",1
1857,"Prior to 2009 , the United States was the leading issuer of IPOs in terms of total value .",0
2583,To hunt fish the eagle swoops down over the water and snatches the fish out of the water with its talons .,1
258,Shall we include diagrams in our sociology presentation ?,1
789,The stockyards became the focal point of the rise of some of the earliest international companies .,1
2330,Human behavior is believed to be influenced by the endocrine system and the nervous system .,1
1974,"Construction is expected to begin by 2019 and operations will commence in 3 phases , from 2026 to 2028 .",1
1928,Hylids will lay their eggs in ponds .,1
2146,The President 's role is largely ceremonial as in many parliamentary democracies .,1
33,"I have to get back to work by one thirty this time , or I will lose my job .",0
2579,"After the June 1976 protests , he was co-founder of assurance to workers charged by the communist regime .",1
2052,"During the war , the town was completely destroyed and the land was made uninhabitable to such an extent that a decision was made not to rebuild it .",1
52,What you read in the newspapers is not always accurate .,0
1250,"Gameplay revolves around the player purchasing food , cat toys , and furniture to attract a variety of cats to their home .",0
2292,The central theme of hydrology is how the water circulates .,1
208,Carla suddenly dropped her bags and ran out of the lecture room .,0
2143,No certain dates can be assigned to this empress 's life or reign .,1
619,Usually each partition contains exactly one file system .,0
2306,Australia has periodically experienced movements seeking to end the monarchy .,1
1776,Rounders is a bat and ball game which is played in Ireland ; a similar version is played in the UK .,0
117,This food has a great deal of unsaturated fat .,1
2125,Wet chemistry commonly uses laboratory glassware such as beakers and graduated cylinders to prevent materials from being contaminated or interfered with by unintended sources .,1
1892,Biogeographic realms are characterized by the evolutionary history of the organisms they contain .,1
609,"However , the principle is applied very broadly beyond bottles to paint and automobile parts such as tires .",0
2035,"Worldwide , breast cancer is the most-common invasive cancer in women .",1
2770,The album caused controversy because of a poster that was inserted in the original record sleeve .,1
1927,The physics affecting the bullet once it leaves the barrel is termed external ballistics .,1
2222,"Many objects cannot achieve negative temperatures , because adding energy to them will increase their entropy .",1
1413,"In the second season , the format of the show changed drastically .",0
1302,A seahorse is used as the company 's icon .,0
361,Have you ever been to Canada 's northern territories ?,0
353,Someone who carried the virus boarded the plane in New York and infected all the passengers .,0
917,The first allotments in the town were sold in 1840 .,0
1317,"In 1997 , 81 % of all soybeans were of genetically modified stock .",0
1444,"Other distances are run , particularly indoors but occasionally outdoors .",0
128,The groom 's family is staying at the hotel .,0
2400,The settlement was near to the crossing of two old merchant roads and a ford over the river Ems .,1
2317,Other types of keels are swing keels and canting keels .,1
2247,The length of the slide rule is quoted in terms of the nominal length of the scales .,1
765,"Depending on the culture , and family and social structures , same - sex preferences have been found to develop between 3 and 9 years old .",1
235,Mrs. Warner 's youngest daughter is always running around and is the most energetic one .,0
137,If you wait a little there will be a definite answer .,0
1437,A tropical wave moved off the western coast of Africa on September 12 .,0
553,"So far , two nuclear weapons have been used in the course of warfare , both by the United States near the end of World War II .",1
236,Do n't feed the geese at the park .,0
780,"The textile and manufacturing sectors across Scotland suffered significant decline in the post-war period and in particular from the 1960s , in the face of greater foreign competition .",1
956,Services can be described in terms of their main attributes .,0
1687,"White is regarded by many as England 's first ecologist , and one of those who shaped the modern attitude of respect for nature .",0
268,"Unfortunately , she is a parent whose rules must be enforced through guilt and manipulation instead of reason and trust .",1
1371,The name used generally refers to the type of military that uses the base .,0
197,It is far enough from the house to the ocean so we wo n't be affected by a tsunami .,0
1809,"A gorilla 's lifespan is between 35 and 40 years , although zoo gorillas may live for 50 years or more because they have more food .",0
1425,"The selection order in the NHL Entry Draft is determined by a combination of lottery , regular season standing , and playoff results .",0
1285,Hopes that the ballet would be ready in May were dashed and the opening night was postponed several times .,0
435,"Since rabbits are prey animals , they are careful in open spaces .",0
2673,"The provinces are grouped into 17 regions based on geographical , cultural , and ethnological characteristics .",1
2792,A double pedal is two pedal tones played simultaneously .,1
1490,"In the 1980s and 1990s , historians began debating the appropriate use of the term .",0
1448,The first two were rarely used except by clipper ships in light winds .,0
2541,Radiation therapy is commonly applied to the cancerous tumor because of its ability to control cell growth .,1
929,"Instead of being assembled by a record label or a producer like most boy bands , 98 Degrees formed independently .",0
2366,The lower part of the trap contains glands which absorb nutrients from captured prey .,1
993,"Still , German influence in the state remains very strong and visible .",0
1787,The story and its main characters attracted little public interest when it first appeared .,0
1381,Coussmaker sat for Reynolds 21 times and his horse 8 times between February 9 and April 16 .,0
2505,"Inductors are also employed in electrical transmission systems , where they are used to limit switching currents and fault currents .",1
2216,The procedure for caring for a beating heart cadaver is the same as caring for a normal patient .,1
2212,The following table lists the progression of the largest known prime number in ascending order .,1
1338,Thousands of school children died because of badly built schools .,0
2037,"Web feeds are designed to be machine - readable rather than human-readable , which tends to be a source of confusion when people first encounter web feeds .",1
1244,There are two kinds of adverbs : first form and second form .,0
1087,"In 1867 , the town had a boom in population when gold and silver were found in the area .",0
1921,"For integrals of vector fields , things are more complicated , because the surface normal is involved .",1
569,Rottnest is one of the few areas in the world where the native quokka can be found .,1
2288,"Walker died after falling into a diabetic coma on 20 January 2015 , aged 41 .",1
1827,"On 29 August 2016 he was reported to be in intensive care , after suffering a stroke .",0
331,"If the public wanted changes , they would demonstrate .",0
885,Other forms of PH are far more common .,0
186,The baby 's room was decorated in pastel colors .,0
614,This coup was soon followed by his first world title in 1942 .,0
492,"The role of the British prime minister 's spouse is not an official office and , as such , they are not given a salary or official duties .",1
1734,The festival authority chooses and invites Asian and Australian movies to participate in different sections .,0
2601,Metics shared the burdens of citizenship without any of its privileges .,1
2070,"Most thinking in genetics has focused on vertical transfer , but there is a growing awareness that horizontal gene transfer is a significant phenomenon .",1
70,Please tell me whether Mr. Williams is considering investing in our company so I know whether or not I should put in the effort to persuade him further .,0
910,"The city suffered from plague outbreaks in 1544 , 1589 and 1598 .",0
483,One of the most famous traditions is leaving a tooth under a pillow for the tooth fairy .,0
1489,A large temple also had a lot of land and employed thousands of ordinary people to supply its needs .,0
18,"After soccer practice , my leg suddenly started hurting .",0
62,I walked through the slush in my boots .,0
1813,Another serious problem for civilians and soldiers alike was a shortage of water .,0
902,Games can be played on indoor or outdoor fields of varying sizes .,0
649,The first electronic version of the dictionary was made available in 1988 .,0
185,I believe it was unlikely that John will be awarded a full scholarship but I 'm sure he will get a partial scholarship .,0
747,"Further anatomical study led him to the conclusion that 'individual Africans differ as much , or even more , from other Africans as from Europeans ' .",1
732,The cause of the vibrations during the first stage of the flight was well known .,1
1549,During the Iron Age humans started using iron for making tools and weapons .,0
1153,"The station 's large hall was the same shape as many 19th century concert halls , that is , it is shaped like a horse shoe .",0
2094,All quarks and gluons in QCD interact with each other through the strong force .,1
1686,"The median income for a household in the county was $ 36,363 , and the median income for a family was $ 41,381 .",0
184,Several black limousines were lined up outside .,0
746,The melodic and harmonic versions of the scale are written in with accidentals as necessary .,1
2367,The lower part of the trap contains glands which take nutrients from captured insects .,1
908,"People here are mainly engaged in agriculture such as paddy , banana and tapioca .",0
409,The orphanage was run by nuns .,1
1218,"The tiger shark is often found close to the coast , mainly in tropical and subtropical waters throughout the world .",0
2065,Synthetic genomics does not use naturally occurring genes .,1
2050,"These animals have a long tail , small eyes , and few pectoral - fin radials .",1
761,"The third act is dominated by the puppet show , a play within the play .",1
1470,At the beginning of the 19th century the building was sold and partly used as a restaurant .,0
740,"Nausea is a non-specific symptom , which means that it has many possible causes .",1
2148,"A three - point stance clothesline is where a wrestler lines up in a three - point stance , charges at the opponent and clotheslines them .",1
1804,A clapstick is a type of musical instrument that is in the category of percussion .,0
2749,"Even though later astronomers tried to find it again , it has not been reliably seen since .",1
2481,Some species of algae form symbiotic relationships with other organisms .,1
527,In 2016 Cocks was diagnosed with kidney cancer .,1
1404,A champion who does not wear the rainbow jersey can be fined 2500 to 5000 Swiss francs .,0
2727,"There are two types of pages in desktop publishing , electronic pages and virtual paper pages to be printed on paper .",1
1441,The second season has a new layout that includes new signs and more original music .,0
2434,Paper clips can be bent into a crude but sometimes effective lock picking device .,1
984,A touchless smart card system is used for single journey tickets .,0
543,Bird eggs are a common food and one of the most versatile ingredients used in cooking .,1
900,"In other cultures , the name may include the place of residence , or the place of birth .",0
1373,Many electronic paper technologies hold static text and images indefinitely without electricity .,0
2002,To prophesy is to make a prophecy .,1
2422,Clusters averaging 75 to 80 individuals live together in complex systems of burrows in arid African deserts .,1
2018,"Stretching is usually done a little bit at a time , so the pierced hole would not bleed or get infected .",1
44,There have been nearly a hundred cases of kidnapping in the past six months .,0
448,"The first trailer for the new movie was released on February 5 , 2015 .",0
1525,X provides the basic framework for a GUI environment : drawing and moving windows on the display device and interacting with a mouse and keyboard .,0
584,"Pollination in this genus is accomplished in an unusual manner , as the pollen is grouped into pollen sacs .",1
2253,"By 1600 , rockets were being used in various parts of Europe against cavalry .",1
29,You may need to adjust your schedule so you can find a balance between academics and leisure time .,0
773,"Many brands of ready sliced bread are available , some of which specifically market their suitability for toasting .",1
603,The initial aim of treatment is to settle the symptoms of an acute attack .,1
940,"Iola has hot , humid summers and generally mild to cool winters .",0
771,Parish councils are run by volunteer councilors who are elected to serve for four years and are not paid .,1
1397,"Production on the movie began in November 1999 and was finished in May 2000 , with a budget of just over $ 50 million .",0
314,Your professor must be notified in advance if you are planning to take his classes next semester .,0
1513,"The airport has one main passenger terminal , serving scheduled and charter holiday flights .",0
2464,VFDs are used in applications ranging from small appliances to large compressors .,1
2342,"At first , historical linguistics was comparative linguistics .",1
386,Too much alcohol prevents you from thinking properly .,0
463,Juvenile birds do not have the white patches on either side of the neck .,0
548,"For people who keep getting infections , taking antibiotics for a long time is helpful .",1
2225,"Objectives included seizing and holding a major port for a short period , both to prove that it was possible and to gather intelligence .",1
2771,The album was a subject of controversy because of a poster inserted in the original record sleeve .,1
2185,"As Europeans made inroads into Africa in the early 19th century , guns were developed to handle the very large game encountered .",1
2267,The most common type of aspirator is the water aspirator .,1
889,This list has the name of the Pharaoh followed by the actual one written on the stone .,0
861,Summer activities such as concerts and boxing matches often tear up the pitch .,0
643,Eyewitnesses described the scene of the execution by burning on 30 May 1431 .,0
2798,This alphabetic system operates on the additive principle in which the numeric values of the letters are added together to form the total .,1
2592,Tropical disturbances that reach tropical storm intensity are named from a pre-determined list .,1
1721,"In November 1973 , an envelope containing a lock of hair and a human ear arrived at a daily newspaper .",0
1277,The middlegame is the part of the game which starts after the opening .,0
2368,There are different hypotheses about when and where PIE was spoken .,1
90,Bees and ants make more complex shelters than mice .,0
2088,The congregation of swamp deer in the park 's grasslands is the largest in the world ; the population of hispid hare may be of international significance .,1
2721,Notable features of the design include key-dependent S-boxes and a highly complex key schedule .,1
2640,The Eid prayer must be offered in congregation .,1
516,Pi bonds result from overlap of atomic orbitals that are in contact through two areas of overlap .,1
1360,"After attending multiple writers ' conventions , she began writing short stories .",0
1915,"The mast cell is very similar in both appearance and function to the basophil , a type of white blood cell .",1
1073,It was one of the 75 divisions set up for the first federal election in 1901 .,0
1559,"The median income for a household in the city was $ 39,375 , and the median income for a family was $ 48,250 .",0
1539,It was supposed that he possessed a healing power against snakebites .,0
342,Shall I drop by the bookstore to pick up my textbook ?,0
1014,Agriculture is one of the main activities in the province .,0
1522,"All hardcovers contain the contents of the comics , including the covers , and in some cases bonus material .",0
2416,"Plant breeding started with the domestication of the first agricultural plants , a practice dates back 9,000 to 11,000 years .",1
1321,Messier 49 has the radio emission of a normal galaxy .,0
